{
  "schema_version": "0.1.0",
  "packet_type": "task",
  "task_id": "example-simple-research-001",
  "created_by": "example",
  "created_at": "2026-05-18T00:00:00Z",
  "task_type": "research",
  "goal": "Summarize the fake project notes in context.md and propose next steps.",
  "context": {
    "summary": "Safe example with fake data only.",
    "source_refs": ["examples/simple-research-task/context.md"]
  },
  "permissions": {
    "browser": {"allowed": false},
    "filesystem": {"allowed_paths": ["examples/simple-research-task", "handoff"]},
    "network": {"allowed_domains": []},
    "adb": {"allowed": false},
    "physical_input": {"allowed": false},
    "memory_writeback": {"allowed": false, "delta_only": true}
  },
  "output_requirements": {
    "write_result_to": "handoff/ga-to-openhuman/example-simple-research-001-result.json",
    "write_evidence_to": "handoff/ga-to-openhuman/evidence/example-simple-research-001/",
    "memory_delta_required": false
  }
}

