{
  "schema_version": "0.1.0",
  "packet_type": "task",
  "task_id": "example-connector-001",
  "created_by": "example",
  "created_at": "2026-05-18T00:00:00Z",
  "task_type": "connector_assisted",
  "goal": "Use a fake connector freshness summary to decide whether browser fallback is needed.",
  "context": {
    "summary": "Connector data is fake and safe.",
    "connector_freshness": {
      "source": "fake-calendar",
      "fresh_at": "2026-05-18T00:00:00Z",
      "status": "fresh"
    },
    "source_refs": []
  },
  "permissions": {
    "browser": {"allowed": false},
    "filesystem": {"allowed_paths": ["handoff"]},
    "network": {"allowed_domains": []},
    "adb": {"allowed": false},
    "physical_input": {"allowed": false},
    "memory_writeback": {"allowed": false, "delta_only": true}
  },
  "output_requirements": {
    "write_result_to": "handoff/ga-to-openhuman/example-connector-001-result.json",
    "write_evidence_to": "handoff/ga-to-openhuman/evidence/example-connector-001/",
    "memory_delta_required": false
  }
}

